{
  "@context": "https://ukiyoue.dev/context/v1",
  "@type": "UseCase",
  "id": "UC-002",
  "title": "記事メタデータを最適化する",
  "actor": "ブログライター",
  "action": "記事のタイトル、ディスクリプション、OGP画像を検索エンジンとSNSに最適化する",
  "benefit": "検索結果でのクリック率が向上し、SNSでのシェア時の見栄えが良くなる",
  "derivedFrom": "BG-001",
  "description": "記事公開前にメタデータを設定することで、検索結果やSNSでの表示を最適化する。タイトルは60文字以内、ディスクリプションは120文字程度に収め、キーワードを自然に含める。",
  "acceptanceCriteria": [
    "タイトルが50-60文字で、主要キーワードを含む",
    "ディスクリプションが100-120文字で、記事内容を簡潔に説明",
    "OGP画像が1200x630pxで視覚的に魅力的",
    "meta robotsタグが適切に設定されている"
  ],
  "priority": "high"
}
