{
  "@context": "https://ukiyoue.dev/context/v1",
  "@type": "UseCase",
  "id": "UC-001",
  "title": "SEOキーワードを選定する",
  "actor": "ブログライター",
  "action": "記事のテーマに合ったSEOキーワード3-5個を選定し、記事メタデータに設定する",
  "benefit": "検索エンジンで上位表示され、検索流入が増える",
  "derivedFrom": "BG-001",
  "description": "記事執筆前にターゲットキーワードを明確にすることで、SEOに最適化された記事を作成できる。競合分析を行い、検索ボリュームと競合度を考慮してキーワードを選定する。",
  "acceptanceCriteria": [
    "キーワードが3-5個選定されている",
    "各キーワードが記事タイトルに自然に含まれている",
    "検索ボリュームが月間100以上である",
    "競合度が中程度以下である（個人ブログで勝てるレベル）"
  ],
  "priority": "high"
}
